[
  {
    "entry_barcodes": [
      { "barcode": "015.019", "floor_id": 1, "boom_barrier_id": 1 },
      { "barcode": "048.049", "floor_id": 2, "boom_barrier_id": 1 },
      { "barcode": "017.011", "floor_id": 1, "boom_barrier_id": 2 }
    ],
    "coordinate_list": [
      { "coordinate": [19, 16], "direction": 2 },
      { "coordinate": [19, 16], "direction": 2 },
      { "coordinate": [49, 47], "direction": 2 },
      { "coordinate": [49, 47], "direction": 2 },
      { "coordinate": [49, 47], "direction": 2 }
    ],
    "type": "c_type",
    "position": "016.019",
    "reinit_barcodes": [
      { "barcodes": ["016.020"], "floor_id": 1 },
      { "barcodes": [], "floor_id": 2 }
    ],
    "elevator_id": 1,
    "exit_barcodes": [
      { "barcode": "017.019", "floor_id": 1, "boom_barrier_id": 3 },
      { "barcode": "047.048", "floor_id": 2, "boom_barrier_id": 4 }
    ]
  },
  {
    "entry_barcodes": [
      { "barcode": "012.012", "floor_id": 1, "boom_barrier_id": 1 },
      { "barcode": "042.042", "floor_id": 2, "boom_barrier_id": 1 }
    ],
    "coordinate_list": [
      { "coordinate": [11, 12], "direction": 2 },
      { "coordinate": [11, 12], "direction": 2 },
      { "coordinate": [41, 42], "direction": 2 },
      { "coordinate": [41, 42], "direction": 2 },
      { "coordinate": [41, 42], "direction": 2 }
    ],
    "type": "c_type",
    "position": "012.011",
    "reinit_barcodes": [
      { "barcodes": [], "floor_id": 1 },
      { "barcodes": [], "floor_id": 2 }
    ],
    "elevator_id": 2,
    "exit_barcodes": [
      { "barcode": "012.010", "floor_id": 1, "boom_barrier_id": 2 },
      { "barcode": "042.040", "floor_id": 2, "boom_barrier_id": 3 }
    ]
  }
]
